{
  "$schema": "http://json-schema.org/draft-04/schema#",
  "type": "object",
  "description": "Describes a Source",
  "title": "Source resource",
  "required": [
    "id",
    "version",
    "label",
    "description",
    "format",
    "caps",
    "tags",
    "device_id",
    "parents"
  ],
  "properties": {
    "id": {
      "description": "Globally unique identifier for the Source",
      "type": "string",
      "pattern": "^[0-9a-f]{8}-[0-9a-f]{4}-[1-5][0-9a-f]{3}-[89ab][0-9a-f]{3}-[0-9a-f]{12}$"
    },
    "version": {
      "description": "String formatted PTP timestamp (<seconds>:<nanoseconds>) indicating precisely when an attribute of the resource last changed",
      "type": "string"
    },
    "label": {
      "description": "Freeform string label for the Source",
      "type": "string"
    },
    "description": {
      "description": "Detailed description of the Source",
      "type": "string"
    },
    "format": {
      "description": "Format of the data coming from the Source as a URN",
      "type": "string",
      "enum": [
        "urn:x-nmos:format:video",
        "urn:x-nmos:format:audio",
        "urn:x-nmos:format:data"
      ]
    },
    "caps": {
      "description": "Capabilities (not yet defined)",
      "type": "object"
    },
    "tags": {
      "description": "Key value set of freeform string tags to aid in filtering Sources. Values should be represented as an array of strings. Can be empty.",
      "type": "object"
    },
    "device_id": {
      "description": "Globally unique identifier for the Device which initially created the Source",
      "type": "string",
      "pattern": "^[0-9a-f]{8}-[0-9a-f]{4}-[1-5][0-9a-f]{3}-[89ab][0-9a-f]{3}-[0-9a-f]{12}$"
    },
    "parents": {
      "description": "Array of UUIDs representing the Source IDs of Grains which came together at the input to this Source (may change over the lifetime of this Source)",
      "type": "array",
      "items": {
        "type": "string",
        "pattern": "^[0-9a-f]{8}-[0-9a-f]{4}-[1-5][0-9a-f]{3}-[89ab][0-9a-f]{3}-[0-9a-f]{12}$"
      }
    }
  }
}
