{
    "description": "Capture Card Source Video", 
    "format": "urn:x-nmos:format:video", 
    "tags": {
        "SourceDeviceType": [
            "HD Camera"
        ], 
        "host": [
            "host1"
        ], 
        "Location": [
            "Location 1"
        ]
    }, 
    "caps": {}, 
    "version": "1441722516:851371645", 
    "parents": [], 
    "label": "CaptureCardSourceVideo", 
    "id": "c23c6a65-8e91-4f6c-a484-046363dbca29", 
    "device_id": "65fa8c20-890e-4b86-87b2-cfd9df91b7f8"
}
