[
    {
        "description": "Camera 1", 
        "format": "urn:x-nmos:format:video", 
        "tags": {
            "SourceDeviceType": [
                "UHD Camera"
            ], 
            "host": [
                "host1"
            ], 
            "location": [
                "Location 1"
            ]
        }, 
        "caps": {}, 
        "version": "1441724551:288670563", 
        "parents": [], 
        "label": "Camera 1", 
        "id": "042a4126-0208-443d-bda6-833ffc27ed51", 
        "device_id": "21a28338-fb2e-4df5-9b55-d58e6124bc9f"
    }, 
    {
        "description": "Camera 2", 
        "format": "urn:x-nmos:format:video", 
        "tags": {
            "SourceDeviceType": [
                "HD Camera"
            ], 
            "host": [
                "host2"
            ], 
            "Location": [
                "Location 2"
            ]
        }, 
        "caps": {}, 
        "version": "1441722516:851371645", 
        "parents": [], 
        "label": "CaptureCardSourceVideo", 
        "id": "c23c6a65-8e91-4f6c-a484-046363dbca29", 
        "device_id": "65fa8c20-890e-4b86-87b2-cfd9df91b7f8"
    }, 
    {
        "description": "Audio 1", 
        "format": "urn:x-nmos:format:audio", 
        "tags": {
            "host": [
                "host3"
            ]
        }, 
        "caps": {}, 
        "version": "1441719058:3226205", 
        "parents": [], 
        "label": "Audio 1", 
        "id": "62cf8dd3-015b-49e3-84c1-1d866a7540bc", 
        "device_id": "e7aa15c4-f793-4d43-a0cb-c638db6215ac"
    }
]
