{
    "description": "Capture Card Source Video",
    "tags": {
        "host": [
            "host1"
        ]
    },
    "format": "urn:x-nmos:format:video",
    "caps": {},
    "version": "1441703336:902850419",
    "parents": [],
    "label": "CaptureCardSourceVideo",
    "id": "4569cea2-ab63-4f97-8dd1-bad4669ea5e4",
    "device_id": "9126cc2f-4c26-4c9b-a6cd-93c4381c9be5"
}
